{
  "ok": true,
  "code": "OK",
  "ms": 18.7,
  "result": {
    "records": [
      {
        "id": "node_1",
        "labels": [
          "Person"
        ],
        "properties": {
          "name": "Ada"
        }
      }
    ],
    "summary": {
      "rows": 1,
      "plan": "IndexSeek"
    },
    "dialect": null,
    "namespace": null
  }
}
