{
  "ok": true,
  "code": "OK",
  "ms": 14.2,
  "result": {
    "text": "Partial output due to length.",
    "model": "test-model-2",
    "model_family": "test-family",
    "usage": {
      "prompt_tokens": 12,
      "completion_tokens": 64,
      "total_tokens": 76
    },
    "finish_reason": "length"
  }
}
